account_id,location,tags,goals,bio
4,"SRID=4326;POINT(41.8781 -87.6298)","{"Weight Loss", "Strength"}","{"Lose 10 lbs", "Build muscle"}","Fitness enthusiast striving for a healthier lifestyle."
6,"SRID=4326;POINT(37.7749 -122.4194)","{"Cardio", "Flexibility"}","{"Improve cardiovascular health", "Increase flexibility"}","Passionate about improving cardiovascular health and flexibility."
8,"SRID=4326;POINT(40.7128 -74.0060)","{"Weight Loss", "Yoga"}","{"Yoga mat", "Resistance bands"}","Yoga and weight loss enthusiast looking for a personalized fitness journey."
10,"SRID=4326;POINT(34.0522 -118.2437)","{"Running", "Strength"}","{"Run a half marathon", "Build muscle"}","Aspiring runner and strength training enthusiast."
12,"SRID=4326;POINT(41.8781 -87.6298)","{"Cardio", "HIIT"}","{"Jump rope", "Kettlebell"}","Seeking high-intensity interval training and cardio workouts for overall fitness."
